{
  "sdkVersion": "1.0.0",
  "grantedCapabilities": ["resource_metadata.read", "workspace_summary.read"],
  "resourceMetadata": {
    "resources": [
      {
        "id": "6f9619ff-8b86-4111-b42d-00cf4fc964ff",
        "displayName": "Planning notes",
        "resourceType": "file",
        "category": "Work",
        "tags": ["planning"],
        "favorite": true
      }
    ],
    "truncated": false
  },
  "workspaceSummary": { "resourceCount": 1, "favoriteCount": 1 }
}
